{
  "schema_version": 1,
  "site_id": "bmh-renovation",
  "display_name": "BMH Rénovation",
  "api_base_url": "https://www.bmh-renovation-16.fr/mobile-api/",
  "auth_methods": ["password_totp", "pairing_code"],
  "branding_preview": {
    "primary": "#E2741F",
    "logo_url": "https://www.bmh-renovation-16.fr/assets/app/logo.webp"
  },
  "support_url": "https://www.bmh-renovation-16.fr/contact/",
  "protocol_min": 1,
  "protocol_max": 1
}
